{
  "schema_version": "observer-log-summary/v1",
  "generated_at": "2026-09-09T13:00:17Z",
  "range": "1h",
  "window_start": "2026-09-09T12:00:00Z",
  "window_end": "2026-09-09T13:00:00Z",
  "bucket_interval_seconds": 60,
  "expected_bucket_count": 60,
  "support_state": "UNAVAILABLE",
  "collection_state": "FAILED",
  "freshness": "UNKNOWN",
  "observed_at": null,
  "reason_code": "LOG_STORAGE_UNAVAILABLE",
  "coverage_state": "UNKNOWN",
  "counts": null,
  "limits": { "max_sources": 2, "max_buckets_per_source": 168, "max_response_bytes": 262144 },
  "privacy": {
    "data_classification": "LOCAL_SENSITIVE",
    "contains_log_bodies": false,
    "contains_event_codes": false,
    "contains_identity_fields": false,
    "remote_upload_eligible": false
  },
  "sources": [
    {
      "source": "application",
      "status": {
        "support_state": "UNAVAILABLE",
        "collection_state": "FAILED",
        "freshness": "UNKNOWN",
        "observed_at": null,
        "attempted_at": "2026-09-09T13:00:00Z",
        "coverage_through": null,
        "reason_code": "LOG_STORAGE_UNAVAILABLE"
      },
      "coverage_state": "UNKNOWN",
      "covered_seconds": 0,
      "counts": null,
      "buckets": [
        { "at": "2026-09-09T12:00:00Z", "coverage_state": "UNKNOWN", "covered_seconds": 0, "reason_code": "NOT_YET_OBSERVED", "counts": null },
        { "at": "2026-09-09T12:01:00Z", "coverage_state": "UNKNOWN", "covered_seconds": 0, "reason_code": "NOT_YET_OBSERVED", "counts": null },
        { "at": "2026-09-09T12:02:00Z", "coverage_state": "UNKNOWN", "covered_seconds": 0, "reason_code": "NOT_YET_OBSERVED", "counts": null },
        { "at": "2026-09-09T12:03:00Z", "coverage_state": "UNKNOWN", "covered_seconds": 0, "reason_code": "NOT_YET_OBSERVED", "counts": null },
        { "at": "2026-09-09T12:04:00Z", "coverage_state": "UNKNOWN", "covered_seconds": 0, "reason_code": "NOT_YET_OBSERVED", "counts": null },
        { "at": "2026-09-09T12:05:00Z", "coverage_state": "UNKNOWN", "covered_seconds": 0, "reason_code": "NOT_YET_OBSERVED", "counts": null },
        { "at": "2026-09-09T12:06:00Z", "coverage_state": "UNKNOWN", "covered_seconds": 0, "reason_code": "NOT_YET_OBSERVED", "counts": null },
        { "at": "2026-09-09T12:07:00Z", "coverage_state": "UNKNOWN", "covered_seconds": 0, "reason_code": "NOT_YET_OBSERVED", "counts": null },
        { "at": "2026-09-09T12:08:00Z", "coverage_state": "UNKNOWN", "covered_seconds": 0, "reason_code": "NOT_YET_OBSERVED", "counts": null },
        { "at": "2026-09-09T12:09:00Z", "coverage_state": "UNKNOWN", "covered_seconds": 0, "reason_code": "NOT_YET_OBSERVED", "counts": null },
        { "at": "2026-09-09T12:10:00Z", "coverage_state": "UNKNOWN", "covered_seconds": 0, "reason_code": "NOT_YET_OBSERVED", "counts": null },
        { "at": "2026-09-09T12:11:00Z", "coverage_state": "UNKNOWN", "covered_seconds": 0, "reason_code": "NOT_YET_OBSERVED", "counts": null },
        { "at": "2026-09-09T12:12:00Z", "coverage_state": "UNKNOWN", "covered_seconds": 0, "reason_code": "NOT_YET_OBSERVED", "counts": null },
        { "at": "2026-09-09T12:13:00Z", "coverage_state": "UNKNOWN", "covered_seconds": 0, "reason_code": "NOT_YET_OBSERVED", "counts": null },
        { "at": "2026-09-09T12:14:00Z", "coverage_state": "UNKNOWN", "covered_seconds": 0, "reason_code": "NOT_YET_OBSERVED", "counts": null },
        { "at": "2026-09-09T12:15:00Z", "coverage_state": "UNKNOWN", "covered_seconds": 0, "reason_code": "NOT_YET_OBSERVED", "counts": null },
        { "at": "2026-09-09T12:16:00Z", "coverage_state": "UNKNOWN", "covered_seconds": 0, "reason_code": "NOT_YET_OBSERVED", "counts": null },
        { "at": "2026-09-09T12:17:00Z", "coverage_state": "UNKNOWN", "covered_seconds": 0, "reason_code": "NOT_YET_OBSERVED", "counts": null },
        { "at": "2026-09-09T12:18:00Z", "coverage_state": "UNKNOWN", "covered_seconds": 0, "reason_code": "NOT_YET_OBSERVED", "counts": null },
        { "at": "2026-09-09T12:19:00Z", "coverage_state": "UNKNOWN", "covered_seconds": 0, "reason_code": "NOT_YET_OBSERVED", "counts": null },
        { "at": "2026-09-09T12:20:00Z", "coverage_state": "UNKNOWN", "covered_seconds": 0, "reason_code": "NOT_YET_OBSERVED", "counts": null },
        { "at": "2026-09-09T12:21:00Z", "coverage_state": "UNKNOWN", "covered_seconds": 0, "reason_code": "NOT_YET_OBSERVED", "counts": null },
        { "at": "2026-09-09T12:22:00Z", "coverage_state": "UNKNOWN", "covered_seconds": 0, "reason_code": "NOT_YET_OBSERVED", "counts": null },
        { "at": "2026-09-09T12:23:00Z", "coverage_state": "UNKNOWN", "covered_seconds": 0, "reason_code": "NOT_YET_OBSERVED", "counts": null },
        { "at": "2026-09-09T12:24:00Z", "coverage_state": "UNKNOWN", "covered_seconds": 0, "reason_code": "NOT_YET_OBSERVED", "counts": null },
        { "at": "2026-09-09T12:25:00Z", "coverage_state": "UNKNOWN", "covered_seconds": 0, "reason_code": "NOT_YET_OBSERVED", "counts": null },
        { "at": "2026-09-09T12:26:00Z", "coverage_state": "UNKNOWN", "covered_seconds": 0, "reason_code": "NOT_YET_OBSERVED", "counts": null },
        { "at": "2026-09-09T12:27:00Z", "coverage_state": "UNKNOWN", "covered_seconds": 0, "reason_code": "NOT_YET_OBSERVED", "counts": null },
        { "at": "2026-09-09T12:28:00Z", "coverage_state": "UNKNOWN", "covered_seconds": 0, "reason_code": "NOT_YET_OBSERVED", "counts": null },
        { "at": "2026-09-09T12:29:00Z", "coverage_state": "UNKNOWN", "covered_seconds": 0, "reason_code": "NOT_YET_OBSERVED", "counts": null },
        { "at": "2026-09-09T12:30:00Z", "coverage_state": "UNKNOWN", "covered_seconds": 0, "reason_code": "NOT_YET_OBSERVED", "counts": null },
        { "at": "2026-09-09T12:31:00Z", "coverage_state": "UNKNOWN", "covered_seconds": 0, "reason_code": "NOT_YET_OBSERVED", "counts": null },
        { "at": "2026-09-09T12:32:00Z", "coverage_state": "UNKNOWN", "covered_seconds": 0, "reason_code": "NOT_YET_OBSERVED", "counts": null },
        { "at": "2026-09-09T12:33:00Z", "coverage_state": "UNKNOWN", "covered_seconds": 0, "reason_code": "NOT_YET_OBSERVED", "counts": null },
        { "at": "2026-09-09T12:34:00Z", "coverage_state": "UNKNOWN", "covered_seconds": 0, "reason_code": "NOT_YET_OBSERVED", "counts": null },
        { "at": "2026-09-09T12:35:00Z", "coverage_state": "UNKNOWN", "covered_seconds": 0, "reason_code": "NOT_YET_OBSERVED", "counts": null },
        { "at": "2026-09-09T12:36:00Z", "coverage_state": "UNKNOWN", "covered_seconds": 0, "reason_code": "NOT_YET_OBSERVED", "counts": null },
        { "at": "2026-09-09T12:37:00Z", "coverage_state": "UNKNOWN", "covered_seconds": 0, "reason_code": "NOT_YET_OBSERVED", "counts": null },
        { "at": "2026-09-09T12:38:00Z", "coverage_state": "UNKNOWN", "covered_seconds": 0, "reason_code": "NOT_YET_OBSERVED", "counts": null },
        { "at": "2026-09-09T12:39:00Z", "coverage_state": "UNKNOWN", "covered_seconds": 0, "reason_code": "NOT_YET_OBSERVED", "counts": null },
        { "at": "2026-09-09T12:40:00Z", "coverage_state": "UNKNOWN", "covered_seconds": 0, "reason_code": "NOT_YET_OBSERVED", "counts": null },
        { "at": "2026-09-09T12:41:00Z", "coverage_state": "UNKNOWN", "covered_seconds": 0, "reason_code": "NOT_YET_OBSERVED", "counts": null },
        { "at": "2026-09-09T12:42:00Z", "coverage_state": "UNKNOWN", "covered_seconds": 0, "reason_code": "NOT_YET_OBSERVED", "counts": null },
        { "at": "2026-09-09T12:43:00Z", "coverage_state": "UNKNOWN", "covered_seconds": 0, "reason_code": "NOT_YET_OBSERVED", "counts": null },
        { "at": "2026-09-09T12:44:00Z", "coverage_state": "UNKNOWN", "covered_seconds": 0, "reason_code": "NOT_YET_OBSERVED", "counts": null },
        { "at": "2026-09-09T12:45:00Z", "coverage_state": "UNKNOWN", "covered_seconds": 0, "reason_code": "NOT_YET_OBSERVED", "counts": null },
        { "at": "2026-09-09T12:46:00Z", "coverage_state": "UNKNOWN", "covered_seconds": 0, "reason_code": "NOT_YET_OBSERVED", "counts": null },
        { "at": "2026-09-09T12:47:00Z", "coverage_state": "UNKNOWN", "covered_seconds": 0, "reason_code": "NOT_YET_OBSERVED", "counts": null },
        { "at": "2026-09-09T12:48:00Z", "coverage_state": "UNKNOWN", "covered_seconds": 0, "reason_code": "NOT_YET_OBSERVED", "counts": null },
        { "at": "2026-09-09T12:49:00Z", "coverage_state": "UNKNOWN", "covered_seconds": 0, "reason_code": "NOT_YET_OBSERVED", "counts": null },
        { "at": "2026-09-09T12:50:00Z", "coverage_state": "UNKNOWN", "covered_seconds": 0, "reason_code": "NOT_YET_OBSERVED", "counts": null },
        { "at": "2026-09-09T12:51:00Z", "coverage_state": "UNKNOWN", "covered_seconds": 0, "reason_code": "NOT_YET_OBSERVED", "counts": null },
        { "at": "2026-09-09T12:52:00Z", "coverage_state": "UNKNOWN", "covered_seconds": 0, "reason_code": "NOT_YET_OBSERVED", "counts": null },
        { "at": "2026-09-09T12:53:00Z", "coverage_state": "UNKNOWN", "covered_seconds": 0, "reason_code": "NOT_YET_OBSERVED", "counts": null },
        { "at": "2026-09-09T12:54:00Z", "coverage_state": "UNKNOWN", "covered_seconds": 0, "reason_code": "NOT_YET_OBSERVED", "counts": null },
        { "at": "2026-09-09T12:55:00Z", "coverage_state": "UNKNOWN", "covered_seconds": 0, "reason_code": "NOT_YET_OBSERVED", "counts": null },
        { "at": "2026-09-09T12:56:00Z", "coverage_state": "UNKNOWN", "covered_seconds": 0, "reason_code": "NOT_YET_OBSERVED", "counts": null },
        { "at": "2026-09-09T12:57:00Z", "coverage_state": "UNKNOWN", "covered_seconds": 0, "reason_code": "NOT_YET_OBSERVED", "counts": null },
        { "at": "2026-09-09T12:58:00Z", "coverage_state": "UNKNOWN", "covered_seconds": 0, "reason_code": "NOT_YET_OBSERVED", "counts": null },
        { "at": "2026-09-09T12:59:00Z", "coverage_state": "UNKNOWN", "covered_seconds": 0, "reason_code": "NOT_YET_OBSERVED", "counts": null }
      ]
    }
  ]
}
