{
  "schema_version": "observer-log-summary/v1",
  "generated_at": "2026-09-09T13:00:17Z",
  "range": "1h",
  "window_start": "2026-09-09T12:00:00Z",
  "window_end": "2026-09-09T13:00:00Z",
  "bucket_interval_seconds": 60,
  "expected_bucket_count": 60,
  "support_state": "DISABLED",
  "collection_state": "NOT_RUN",
  "freshness": "UNKNOWN",
  "observed_at": null,
  "reason_code": "LOG_SOURCES_DISABLED",
  "coverage_state": "UNKNOWN",
  "counts": null,
  "limits": {
    "max_sources": 2,
    "max_buckets_per_source": 168,
    "max_response_bytes": 262144
  },
  "privacy": {
    "data_classification": "LOCAL_SENSITIVE",
    "contains_log_bodies": false,
    "contains_event_codes": false,
    "contains_identity_fields": false,
    "remote_upload_eligible": false
  },
  "sources": []
}
